{
  "schema_version": "1.0",
  "record_id": "example-ecg-001",
  "patient_id": "NL-CR-001",
  "device_type": "generic_ecg_patch",
  "device_identifier": "ECG-SIM-001",
  "source": {
    "type": "simulated",
    "name": "CareAI Device JSON Generator"
  },
  "measurement_timestamp": "2026-09-16T10:30:00Z",
  "measurements": {
    "heart_rate": {
      "value": 72,
      "unit": "bpm"
    },
    "rr_interval": {
      "value": 833,
      "unit": "ms"
    },
    "pr_interval": {
      "value": 160,
      "unit": "ms"
    },
    "qrs_duration": {
      "value": 92,
      "unit": "ms"
    },
    "qt_interval": {
      "value": 390,
      "unit": "ms"
    },
    "qtc": {
      "value": 427,
      "unit": "ms"
    }
  },
  "recording": {
    "lead": "Lead I",
    "sampling_rate_hz": 250,
    "duration_seconds": 1,
    "amplitude_unit": "mV",
    "samples": [
      0.0,
      0.0025,
      0.0049,
      0.0073,
      0.0096,
      0.0117,
      0.0136,
      0.0154,
      0.0168,
      0.018,
      0.019,
      0.0196,
      0.0199,
      0.02,
      0.0197,
      0.0191,
      0.0182,
      0.017,
      0.0156,
      0.0139,
      0.012,
      0.0099,
      0.0076,
      0.0053,
      0.0028,
      0.0003,
      -0.0022,
      -0.0046,
      -0.007,
      -0.0093,
      -0.0114,
      -0.0134,
      -0.0151,
      -0.0166,
      -0.0179,
      -0.0189,
      -0.0196,
      -0.0199,
      -0.02,
      -0.0197,
      -0.0192,
      -0.0183,
      -0.0172,
      -0.0158,
      -0.0141,
      -0.0122,
      -0.0102,
      -0.0079,
      -0.0056,
      -0.0032,
      -0.0007,
      0.0018,
      0.0043,
      0.0067,
      0.009,
      0.0112,
      0.0131,
      0.0149,
      0.0165,
      0.0177,
      0.0188,
      0.0195,
      0.0199,
      0.02,
      0.0198,
      0.0193,
      0.0185,
      0.0173,
      0.016,
      0.0143,
      0.0125,
      0.0104,
      0.0082,
      0.0059,
      0.0035,
      0.001,
      -0.0015,
      -0.004,
      -0.0064,
      -0.0087,
      -0.0109,
      -0.0129,
      -0.0147,
      -0.0163,
      -0.0176,
      -0.0186,
      -0.0194,
      -0.0199,
      -0.02,
      -0.0198,
      -0.0194,
      -0.0186,
      -0.0175,
      -0.0162,
      -0.0146,
      -0.0128,
      -0.0107,
      -0.0085,
      -0.0062,
      -0.0038,
      -0.0013,
      0.0012,
      0.0037,
      0.0061,
      0.0084,
      0.0106,
      0.0126,
      0.0145,
      0.0161,
      0.0174,
      0.0185,
      0.0193,
      0.0198,
      0.02,
      0.0199,
      0.0194,
      0.0187,
      0.0177,
      0.0164,
      0.0148,
      0.013,
      0.011,
      0.0088,
      0.0065,
      0.0041,
      0.0017,
      -0.0008,
      -0.0033,
      -0.0058,
      -0.0081,
      -0.0103,
      -0.0124,
      -0.0142,
      -0.0159,
      -0.0173,
      -0.0184,
      -0.0192,
      -0.0198,
      -0.02,
      -0.0199,
      -0.0195,
      -0.0188,
      -0.0178,
      -0.0165,
      -0.015,
      -0.0133,
      -0.0113,
      -0.0091,
      -0.0068,
      -0.0045,
      -0.002,
      0.0005,
      0.003,
      0.0054,
      0.0078,
      0.01,
      0.0121,
      0.014,
      0.0157,
      0.0171,
      0.0183,
      0.0191,
      0.0197,
      0.02,
      0.0199,
      0.0196,
      0.0189,
      0.018,
      0.0167,
      0.0152,
      0.0135,
      0.0116,
      0.0094,
      0.0072,
      0.0048,
      0.0023,
      -0.0002,
      -0.0027,
      -0.0051,
      -0.0075,
      -0.0097,
      -0.0118,
      -0.0138,
      -0.0155,
      -0.0169,
      -0.0181,
      -0.019,
      -0.0197,
      -0.02,
      -0.02,
      -0.0196,
      -0.019,
      -0.0181,
      -0.0169,
      -0.0154,
      -0.0137,
      -0.0118,
      -0.0097,
      -0.0075,
      -0.0051,
      -0.0026,
      -0.0002,
      0.0023,
      0.0048,
      0.0072,
      0.0095,
      0.0116,
      0.0135,
      0.0153,
      0.0167,
      0.018,
      0.0189,
      0.0196,
      0.0199,
      0.02,
      0.0197,
      0.0191,
      0.0182,
      0.0171,
      0.0157,
      0.014,
      0.0121,
      0.01,
      0.0078,
      0.0054,
      0.003,
      0.0005,
      -0.002,
      -0.0045,
      -0.0069,
      -0.0092,
      -0.0113,
      -0.0133,
      -0.015,
      -0.0166,
      -0.0178,
      -0.0188,
      -0.0195,
      -0.0199,
      -0.02,
      -0.0198,
      -0.0192,
      -0.0184,
      -0.0173,
      -0.0159,
      -0.0142,
      -0.0124,
      -0.0103,
      -0.0081,
      -0.0057
    ]
  }
}